{
  "active": false,
  "phase": "implement",
  "gate_stage": "write",
  "current_module_id": "MOD-DRSAM-AUTH",
  "current_item_id": "AUTH-01-index-login-entry",
  "modules": [
    {
      "id": "MOD-DRSAM-AUTH",
      "decompose_passes": true,
      "items": [
        {
          "id": "AUTH-01-index-login-entry",
          "implement_passes": true,
          "implement_gate": "triage",
          "implement_iteration": 0,
          "coverage_pct": 92,
          "depends_on": [],
          "target_files": [
            "frontend/src/pages/IndexPage.vue",
            "frontend/src/router/index.ts",
            "frontend/src/features/auth/routes.ts"
          ]
        },
        {
          "id": "AUTH-02-reset-password",
          "implement_passes": true,
          "implement_gate": "triage",
          "implement_iteration": 1,
          "coverage_pct": 100,
          "depends_on": [],
          "target_files": [
            "frontend/src/pages/ResetPasswordPage.vue",
            "frontend/src/features/auth/resetPasswordApi.ts"
          ]
        },
        {
          "id": "AUTH-03-onboarding-wizard-shell",
          "implement_passes": true,
          "implement_gate": "triage",
          "implement_iteration": 0,
          "coverage_pct": 100,
          "depends_on": [
            "ENUM-01-navigation-and-onboarding-labels"
          ],
          "target_files": [
            "frontend/src/pages/OnboardingPage.vue",
            "frontend/src/features/onboarding/onboardingStore.ts",
            "frontend/src/features/onboarding/stepRegistry.ts"
          ]
        },
        {
          "id": "AUTH-04-onboarding-profile-questions",
          "implement_passes": true,
          "implement_gate": "triage",
          "implement_iteration": 1,
          "coverage_pct": 100,
          "depends_on": [
            "AUTH-03-onboarding-wizard-shell",
            "ENUM-02-onboarding-question-enums"
          ],
          "target_files": [
            "frontend/src/features/onboarding/steps/ProfileQuestionsStep.vue",
            "frontend/src/features/onboarding/steps/RolePillarStep.vue"
          ]
        },
        {
          "id": "AUTH-05-onboarding-health-load-signals",
          "implement_passes": true,
          "implement_gate": "triage",
          "implement_iteration": 0,
          "coverage_pct": 100,
          "depends_on": [
            "AUTH-03-onboarding-wizard-shell",
            "ENUM-02-onboarding-question-enums"
          ],
          "target_files": [
            "frontend/src/features/onboarding/steps/HealthSignalsStep.vue",
            "frontend/src/features/onboarding/steps/LoadSignalsStep.vue",
            "frontend/src/features/onboarding/completeOnboarding.ts"
          ]
        }
      ],
      "decompose_gate": "triage",
      "decompose_iteration": 0
    },
    {
      "id": "MOD-DRSAM-SHELL",
      "decompose_passes": true,
      "items": [
        {
          "id": "SHELL-01-offline-banner",
          "implement_passes": true,
          "implement_gate": "triage",
          "implement_iteration": 1,
          "coverage_pct": 100,
          "depends_on": [],
          "target_files": [
            "frontend/src/components/shell/OfflineBanner.vue",
            "frontend/src/composables/useOnlineStatus.ts"
          ]
        },
        {
          "id": "SHELL-02-sidebar-navigation",
          "implement_passes": true,
          "implement_gate": "triage",
          "implement_iteration": 0,
          "coverage_pct": 100,
          "depends_on": [
            "ENUM-01-navigation-and-onboarding-labels"
          ],
          "target_files": [
            "frontend/src/components/shell/Sidebar.vue",
            "frontend/src/components/shell/SidebarNavLink.vue"
          ]
        },
        {
          "id": "SHELL-03-header-bar-and-profile-menu",
          "implement_passes": true,
          "implement_gate": "triage",
          "implement_iteration": 0,
          "coverage_pct": 100,
          "depends_on": [
            "ENUM-01-navigation-and-onboarding-labels",
            "AUTH-01-index-login-entry"
          ],
          "target_files": [
            "frontend/src/components/shell/Header.vue",
            "frontend/src/components/shell/HeaderProfileDropdown.vue"
          ]
        },
        {
          "id": "SHELL-04-header-login-signup-popups",
          "implement_passes": true,
          "implement_gate": "triage",
          "implement_iteration": 0,
          "coverage_pct": 100,
          "depends_on": [
            "SHELL-03-header-bar-and-profile-menu",
            "AUTH-01-index-login-entry",
            "AUTH-02-reset-password"
          ],
          "target_files": [
            "frontend/src/components/shell/LoginPopup.vue",
            "frontend/src/components/shell/SignupPopup.vue"
          ]
        },
        {
          "id": "SHELL-05-app-shell-layout",
          "implement_passes": true,
          "implement_gate": "triage",
          "implement_iteration": 0,
          "coverage_pct": 100,
          "depends_on": [
            "SHELL-01-offline-banner",
            "SHELL-02-sidebar-navigation",
            "SHELL-03-header-bar-and-profile-menu",
            "AUTH-05-onboarding-health-load-signals"
          ],
          "target_files": [
            "frontend/src/layouts/AppShellLayout.vue",
            "frontend/src/router/guards/requireAuth.ts",
            "frontend/src/router/authenticatedRoutes.ts"
          ]
        },
        {
          "id": "SHELL-06-dashboard-page-shell",
          "implement_passes": true,
          "implement_gate": "triage",
          "implement_iteration": 0,
          "coverage_pct": 100,
          "depends_on": [
            "SHELL-05-app-shell-layout",
            "ENUM-01-navigation-and-onboarding-labels"
          ],
          "target_files": [
            "frontend/src/pages/DashboardPage.vue",
            "frontend/src/features/dashboard/routes.ts"
          ]
        },
        {
          "id": "SHELL-07-journal-page-shell",
          "implement_passes": true,
          "implement_gate": "triage",
          "implement_iteration": 0,
          "coverage_pct": 100,
          "depends_on": [
            "SHELL-05-app-shell-layout",
            "ENUM-01-navigation-and-onboarding-labels"
          ],
          "target_files": [
            "frontend/src/pages/JournalPage.vue",
            "frontend/src/features/journal/routes.ts"
          ]
        },
        {
          "id": "SHELL-08-paths-page-shell",
          "implement_passes": true,
          "implement_gate": "triage",
          "implement_iteration": 0,
          "coverage_pct": 100,
          "depends_on": [
            "SHELL-05-app-shell-layout",
            "ENUM-01-navigation-and-onboarding-labels",
            "ENUM-03-path-coaching-and-state-enums"
          ],
          "target_files": [
            "frontend/src/pages/PathsPage.vue",
            "frontend/src/features/paths/routes.ts"
          ]
        },
        {
          "id": "SHELL-09-settings-page-shell",
          "implement_passes": true,
          "implement_gate": "triage",
          "implement_iteration": 0,
          "coverage_pct": 100,
          "depends_on": [
            "SHELL-05-app-shell-layout",
            "ENUM-01-navigation-and-onboarding-labels"
          ],
          "target_files": [
            "frontend/src/pages/SettingsPage.vue",
            "frontend/src/features/settings/routes.ts",
            "frontend/src/features/settings/settingsTabStub.ts"
          ]
        },
        {
          "id": "SHELL-10-chat-page-shell",
          "implement_passes": true,
          "implement_gate": "triage",
          "implement_iteration": 0,
          "coverage_pct": 100,
          "depends_on": [
            "SHELL-05-app-shell-layout",
            "ENUM-01-navigation-and-onboarding-labels",
            "ENUM-03-path-coaching-and-state-enums"
          ],
          "target_files": [
            "frontend/src/pages/ChatPage.vue",
            "frontend/src/features/chat/routes.ts"
          ]
        }
      ],
      "decompose_gate": "triage",
      "decompose_iteration": 0
    },
    {
      "id": "MOD-DRSAM-ENUMS",
      "decompose_passes": true,
      "items": [
        {
          "id": "ENUM-01-navigation-and-onboarding-labels",
          "implement_passes": true,
          "implement_gate": "triage",
          "implement_iteration": 0,
          "coverage_pct": 100,
          "depends_on": [],
          "target_files": [
            "frontend/src/domain/enums/onboardingSteps.ts",
            "frontend/src/domain/enums/pathPageTabs.ts",
            "frontend/src/domain/enums/settingsTabs.ts",
            "frontend/src/domain/enums/index.ts"
          ]
        },
        {
          "id": "ENUM-02-onboarding-question-enums",
          "implement_passes": true,
          "implement_gate": "triage",
          "implement_iteration": 2,
          "coverage_pct": 100,
          "depends_on": [
            "ENUM-01-navigation-and-onboarding-labels"
          ],
          "target_files": [
            "frontend/src/domain/enums/onboardingQuestions.ts",
            "frontend/src/domain/enums/customerProfile.ts"
          ]
        },
        {
          "id": "ENUM-03-path-coaching-and-state-enums",
          "implement_passes": true,
          "implement_gate": "triage",
          "implement_iteration": 0,
          "coverage_pct": 100,
          "depends_on": [
            "ENUM-01-navigation-and-onboarding-labels"
          ],
          "target_files": [
            "frontend/src/domain/enums/pathEnrollment.ts",
            "frontend/src/domain/enums/coachingMode.ts",
            "frontend/src/domain/enums/wellnessState.ts"
          ]
        },
        {
          "id": "ENUM-04-tier-and-subscription-labels",
          "implement_passes": true,
          "implement_gate": "triage",
          "implement_iteration": 0,
          "coverage_pct": 100,
          "depends_on": [],